US-8406041-B2,Scalable magnetic memory cell with reduced write current ,Alexander Mikhailovich Shukh,Alexander Mikhailovich Shukh,2009-07-08,2010-07-06,2013-03-26,2013-03-26,https://patents.google.com/patent/US8406041B2/en,https://patentimages.storage.googleapis.com/76/a0/87/3ed8fbbafcbcf9/US08406041-20130326-D00000.png
US-10490216-B1,Magnetic flux guiding device with antiferromagnetically coupled (AFC) oscillator in assisted writing application ,"Headway Technologies, Inc.","Wenyu Chen, Shohei Kawasaki, Tetsuya Roppongi, Yan Wu",2018-12-04,2018-12-04,2019-11-26,2019-11-26,https://patents.google.com/patent/US10490216B1/en,https://patentimages.storage.googleapis.com/fa/32/7c/c498d91da4a527/US10490216-20191126-D00000.png
US-8734620-B2,Method of making a thin seeded Co/Ni multilayer film with perpendicular anisotropy for read head sensor stabilization ,"Headway Technologies, Inc.","Zhang Kunliang, Li Min, Zhou Yuchen, Zheng Min",2009-06-24,2013-10-08,2014-05-27,2014-05-27,https://patents.google.com/patent/US8734620B2/en,https://patentimages.storage.googleapis.com/99/62/c4/0ee59d8c70cdbe/US08734620-20140527-D00000.png
US-11398596-B2,Magnetic tunnel junction (MTJ) integration on backside of silicon ,Intel Corporation,"Sasikanth Manipatruni, Tanay Gosavi, Ian Young, Dmitri Nikonov",2018-06-28,2018-06-28,2022-07-26,2022-07-26,https://patents.google.com/patent/US11398596B2/en,https://patentimages.storage.googleapis.com/6a/3d/27/1bd19453fc8521/US11398596-20220726-D00000.png
US-10811067-B2,Magnetic memory device with nonmagnetic layer between two magnetic layers ,Kabushiki Kaisha Toshiba,"Altansargai BUYANDALAI, Satoshi Shirotori, Yuichi Ohsawa, Hideyuki Sugiyama, Mariko Shimizu, Hiroaki Yoda, Katsuhiko Koui",2018-03-15,2018-08-31,2020-10-20,2020-10-20,https://patents.google.com/patent/US10811067B2/en,https://patentimages.storage.googleapis.com/ef/6b/d1/07ca2ac8780bae/US10811067-20201020-D00000.png
US-11257862-B2,MRAM having spin hall effect writing and method of making the same ,Yimin Guo,Yimin Guo,2015-01-30,2015-01-30,2022-02-22,2022-02-22,https://patents.google.com/patent/US11257862B2/en,https://patentimages.storage.googleapis.com/6b/af/58/b326bb4cd000f9/US11257862-20220222-D00000.png
US-8514525-B2,Current-perpendicular-to-the-plane (CPP) magnetoresistive (MR) sensor with reference layer integrated in magnetic shield ,HGST Netherlands B.V.,"Jeffrey R. Childress, Jordan Asher Katine, Manfred Ernst Schabes",2010-09-13,2010-09-13,2013-08-20,2013-08-20,https://patents.google.com/patent/US8514525B2/en,https://patentimages.storage.googleapis.com/91/83/b8/593c43703e7378/US08514525-20130820-D00000.png
US-10305027-B2,Magnetoresistive element and magnetic memory device ,"Kabushiki Kaisha Toshiba, National Institute For Materials Science","Yushi Kato, Tadaomi Daibou, Yuuzo Kamiguchi, Naoharu Shimomura, Junichi Ito, Hiroaki Sukegawa, Mohamed BELMOUBARIK, Po-Han CHENG, Seiji Mitani, Tadakatsu Ohkubo, Kazuhiro Hono",2016-09-28,2017-09-08,2019-05-28,2019-05-28,https://patents.google.com/patent/US10305027B2/en,https://patentimages.storage.googleapis.com/47/02/b9/abdaebc7eda139/US10305027-20190528-D00000.png
US-8018691-B2,CPP dual free layer magnetoresistive head for magnetic data storage ,Hitachi Global Storage Technologies Netherlands B.V.,"Hardayal Singh Gill, Chang-Man Park",2008-10-20,2008-10-20,2011-09-13,2011-09-13,https://patents.google.com/patent/US8018691B2/en,https://patentimages.storage.googleapis.com/ca/a9/63/8e41151778abe7/US08018691-20110913-D00000.png
US-9704551-B2,Magnetic tunnel junction switching assisted by temperature-gradient induced spin torque ,International Business Machines Corporation,"Stuart S.P. Parkin, Timothy Phung, Aakash Pushp",2015-04-29,2015-04-19,2017-07-11,2017-07-11,https://patents.google.com/patent/US9704551B2/en,https://patentimages.storage.googleapis.com/e1/56/7e/1384899bef6fab/US09704551-20170711-D00000.png
US-8236576-B2,Magnetic logic element with toroidal multiple magnetic films and a method of logic treatment using the same ,"Institute Of Physics, Chinese Academy Of Sciences","Xiufeng Han, Zhongming Zeng, Yunan Han, Lixian Jiang, Zilong Peng, Wenshan Zhan",2006-04-11,2007-04-11,2012-08-07,2012-08-07,https://patents.google.com/patent/US8236576B2/en,https://patentimages.storage.googleapis.com/b5/9b/6b/f7a285a9c82b89/US08236576-20120807-D00000.png
US-8941196-B2,Precessional reversal in orthogonal spin transfer magnetic RAM devices ,New York University,"Daniel Bedau, Huanlong Liu, Andrew David KENT",2012-07-10,2013-07-03,2015-01-27,2015-01-27,https://patents.google.com/patent/US8941196B2/en,https://patentimages.storage.googleapis.com/bd/72/34/c53f948c6da4da/US08941196-20150127-D00000.png
US-9147455-B2,Storage element having laminated storage layer including magnetic layer and conductive oxide and storage device including the storage element ,Sony Corporation,"Kazuhiro Bessho, Masanori Hosomi, Hiroyuki Ohmori, Yutaka Higo, Kazutaka Yamane, Hiroyuki Uchida, Tetsuya Asayama",2011-01-07,2011-12-22,2015-09-29,2015-09-29,https://patents.google.com/patent/US9147455B2/en,https://patentimages.storage.googleapis.com/3c/cb/d6/d1bda3f4385c87/US09147455-20150929-D00000.png
US-9129893-B2,Semiconductor device ,Renesas Electronics Corporation,Fumihiko Nitta,2011-02-04,2014-10-01,2015-09-08,2015-09-08,https://patents.google.com/patent/US9129893B2/en,https://patentimages.storage.googleapis.com/23/47/54/94340be501692d/US09129893-20150908-D00000.png
US-10196754-B2,Conversion of carbon into n-type and p-type doped diamond and structures ,North Carolina State University,Jagdish Narayan,2015-08-07,2016-08-08,2019-02-05,2019-02-05,https://patents.google.com/patent/US10196754B2/en,https://patentimages.storage.googleapis.com/0b/25/db/649295becb6a15/US10196754-20190205-D00001.png
US-RE49364-E,"Memory element, memory apparatus ",Sony Corporation,"Hiroyuki Uchida, Masanori Hosomi, Hiroyuki Ohmori, Kazuhiro Bessho, Yutaka Higo, Tetsuya Asayama, Kazutaka Yamane",2011-11-30,2020-03-06,2023-01-10,2023-01-10,https://patents.google.com/patent/USRE49364E1/en,https://patentimages.storage.googleapis.com/a0/9b/13/651c3b57ab303d/USRE049364-20230110-D00000.png
US-7633796-B2,Storage element and memory ,Sony Corporation,"Kazutaka Yamane, Minoru Ikarashi, Masanori Hosomi, Hiroyuki Ohmori, Tetsuya Yamamoto, Yutaka Higo, Yuki Oishi, Hiroshi Kano",2007-01-19,2008-01-14,2009-12-15,2009-12-15,https://patents.google.com/patent/US7633796B2/en,https://patentimages.storage.googleapis.com/4d/42/7b/3b86dd3d152f34/US07633796-20091215-D00000.png
US-9006849-B2,Hybrid method of patterning MTJ stack ,Yimin Guo,Yimin Guo,2013-04-07,2014-03-26,2015-04-14,2015-04-14,https://patents.google.com/patent/US9006849B2/en,https://patentimages.storage.googleapis.com/e6/68/71/b75473e56ae19a/US09006849-20150414-D00000.png
US-8565013-B2,Storage element and storage device ,Sony Corporation,"Kazuhiro Bessho, Masanori Hosomi, Hiroyuki Ohmori, Yutaka Higo, Kazutaka Yamane, Tetsuya Asayama, Hiroyuki Uchida",2011-05-06,2012-03-29,2013-10-22,2013-10-22,https://patents.google.com/patent/US8565013B2/en,https://patentimages.storage.googleapis.com/94/c6/b1/12168c99d9068f/US08565013-20131022-D00000.png
US-9287323-B2,Perpendicular magnetoresistive elements ,Yimin Guo,Yimin Guo,2013-01-08,2014-01-07,2016-03-15,2016-03-15,https://patents.google.com/patent/US9287323B2/en,https://patentimages.storage.googleapis.com/dd/c4/98/16e94e10275307/US09287323-20160315-D00000.png
US-11444240-B2,Giant enhancement of spin-orbit torque by interface scattering from ultra-thin insertion layers ,Cornell University,"Robert A. Buhrman, Lijun Zhu",2019-03-15,2020-03-16,2022-09-13,2022-09-13,https://patents.google.com/patent/US11444240B2/en,https://patentimages.storage.googleapis.com/95/24/32/eebf9507988f36/US11444240-20220913-D00000.png
US-10971677-B2,Electrically controlled nanomagnet and spin orbit torque magnetic random access memory including the same ,Academia Sinica,"Hsin Lin, Shih-Yu Wu, Chuang-Han HSU",2018-12-27,2019-12-11,2021-04-06,2021-04-06,https://patents.google.com/patent/US10971677B2/en,https://patentimages.storage.googleapis.com/9c/f2/0b/d6ff14b55afdb7/US10971677-20210406-D00000.png
US-7902616-B2,Integrated circuit having a magnetic tunnel junction device and method ,Qimonda Ag,"Ulrich Klostermann, Franz Kreupl",2008-06-30,2008-06-30,2011-03-08,2011-03-08,https://patents.google.com/patent/US7902616B2/en,https://patentimages.storage.googleapis.com/31/f7/65/198d6b6be5df82/US07902616-20110308-D00000.png
US-11205446-B1,Spin-orbit torque induced magnetization switching in a magnetic recording head ,"Western Digital Technologies, Inc.","Zhanjie Li, Suping Song, Kuok San Ho",2019-03-27,2020-02-27,2021-12-21,2021-12-21,https://patents.google.com/patent/US11205446B1/en,https://patentimages.storage.googleapis.com/9f/71/24/88ceeb9fd17ae6/US11205446-20211221-D00000.png
US-8841139-B2,Magnetic memory and method of fabricating the same ,Kabushiki Kaisha Toshiba,"Chikayoshi Kamata, Minoru Amano, Tadaomi Daibou, Junichi Ito",2012-03-21,2012-09-20,2014-09-23,2014-09-23,https://patents.google.com/patent/US8841139B2/en,https://patentimages.storage.googleapis.com/a5/8a/82/f6d8a530077eb8/US08841139-20140923-D00000.png
US-10790440-B2,Magnetoresistance effect element ,Tdk Corporation,"Tomoyuki Sasaki, Tatsuo Shibata, Katsuyuki Nakada, Yoshitomo Tanaka",2015-03-31,2019-09-30,2020-09-29,2020-09-29,https://patents.google.com/patent/US10790440B2/en,https://patentimages.storage.googleapis.com/49/b9/7a/b2bef0958323ca/US10790440-20200929-D00000.png
US-9793469-B2,Magnetoresistive element and magnetic memory ,Kabushiki Kaisha Toshiba,"Yushi Kato, Tadaomi Daibou, Yuichi Ohsawa, Shumpei OMINE, Naoki Hase",2014-03-13,2016-09-08,2017-10-17,2017-10-17,https://patents.google.com/patent/US9793469B2/en,https://patentimages.storage.googleapis.com/d6/8d/ec/6cfad574d3d1f5/US09793469-20171017-D00000.png
US-7782575-B2,"Magnetoresistive element having free layer, pinned layer, and spacer layer disposed therebetween, the spacer layer including semiconductor layer ",Tdk Corporation,"Yoshihiro Tsuchiya, Kei Hirata, Tomohito Mizuno, Koji Shimazawa",2006-09-08,2007-01-26,2010-08-24,2010-08-24,https://patents.google.com/patent/US7782575B2/en,https://patentimages.storage.googleapis.com/6c/43/40/0188ded65f1c55/US07782575-20100824-D00000.png
US-10468455-B2,Simplified double magnetic tunnel junctions ,"International Business Machines Corporation, Samsung Electronics, Co., Ltd.","Guohan Hu, Younghyun Kim, Jeong-Heon Park, Daniel Worledge",2016-04-12,2016-04-12,2019-11-05,2019-11-05,https://patents.google.com/patent/US10468455B2/en,https://patentimages.storage.googleapis.com/1d/01/74/c0c406b29c88f9/US10468455-20191105-D00000.png
US-8514605-B2,MRAM diode array and access method ,Seagate Technology Llc,"Yiran Chen, Hai Li, Hongyue Liu, Yong Lu, Song S. Xue",2008-10-20,2012-09-12,2013-08-20,2013-08-20,https://patents.google.com/patent/US8514605B2/en,https://patentimages.storage.googleapis.com/1a/b3/86/7208313b66867a/US08514605-20130820-D00000.png
US-8111540-B2,Semiconductor memory device ,Kabushiki Kaisha Toshiba,"Yoshiaki Asao, Takeshi Kajiyama, Tsuneo Inaba",2008-10-23,2009-09-14,2012-02-07,2012-02-07,https://patents.google.com/patent/US8111540B2/en,https://patentimages.storage.googleapis.com/cb/36/57/c678c280e73354/US08111540-20120207-D00000.png
US-8077509-B2,Magnetic memory ,Kabushiki Kaisha Toshiba,"Satoshi Yanagi, Yuichi Ohsawa, Shiho Nakamura, Daisuke Saida, Hirofumi Morise",2008-02-14,2009-02-10,2011-12-13,2011-12-13,https://patents.google.com/patent/US8077509B2/en,https://patentimages.storage.googleapis.com/74/e2/f7/87eb5597a0c006/US08077509-20111213-D00000.png
US-7821819-B2,Semiconductor memory device and its data reading method ,Sony Corporation,Hidenari Hachino,2007-06-13,2008-05-05,2010-10-26,2010-10-26,https://patents.google.com/patent/US7821819B2/en,https://patentimages.storage.googleapis.com/0a/d8/2b/ecf1b09d4b7958/US07821819-20101026-D00000.png
US-7710769-B2,Data storage device and method ,Ingenia Holdings Uk Limited,"Russell Paul Cowburn, Dorothee Petit, Dan Read",2007-05-09,2008-04-18,2010-05-04,2010-05-04,https://patents.google.com/patent/US7710769B2/en,https://patentimages.storage.googleapis.com/c4/2c/2b/7df0c7706a97ce/US07710769-20100504-D00000.png
US-7266012-B2,Magnetoresistive effect element and magnetic memory ,Kabushiki Kaisha Toshiba,"Yoshiaki Saito, Hideyuki Sugiyama, Tomoaki Inokuchi",2005-07-20,2006-03-13,2007-09-04,2007-09-04,https://patents.google.com/patent/US7266012B2/en,https://patentimages.storage.googleapis.com/63/06/22/d7f2eb81c76a77/US07266012-20070904-D00000.png
US-7894244-B2,"Tunnel magnetic resistance device, and magnetic memory cell and magnetic random access memory using the same ","Hitachi, Ltd., Tohoku University","Jun Hayakawa, Hideo Ohno, Shoji Ikeda, Young Min Lee",2006-04-26,2007-04-25,2011-02-22,2011-02-22,https://patents.google.com/patent/US7894244B2/en,https://patentimages.storage.googleapis.com/68/ac/1b/880a43ec1ff517/US07894244-20110222-D00000.png
US-10643642-B2,Apparatus and method for writing to magnetic media using an AC bias current to enhance the write field ,"Western Digital Technologies, Inc.","Gonçalo Marcos Baião De Albuquerque, Yunfei Ding, Alexander GONCHAROV, Kuok San Ho, Daniele Mauri, Goran Mihajlovic, Suping Song, Petrus Antonius Van der Heijden",2016-12-30,2019-07-01,2020-05-05,2020-05-05,https://patents.google.com/patent/US10643642B2/en,https://patentimages.storage.googleapis.com/0d/66/8e/38553d2bbdbfc3/US10643642-20200505-D00000.png
US-8508981-B2,Apparatus for variable resistive memory punchthrough access method ,Seagate Technology Llc,"Maroun Georges Khoury, Hongyue Liu, Brian Lee, Andrew John Gjevre Carter",2008-10-30,2012-05-23,2013-08-13,2013-08-13,https://patents.google.com/patent/US8508981B2/en,https://patentimages.storage.googleapis.com/48/62/ea/53b2ca6e08767b/US08508981-20130813-D00000.png
US-9536584-B2,Nonvolatile logic gate device ,"Nec Corporation, Tohoku University","Ryusuke Nebashi, Noboru Sakimura, Yukihide Tsuji, Ayuka Tada, Tadahiko Sugibayashi, Takahiro Hanyu, Tetsuo Endoh, Hideo Ohno",2012-06-11,2013-05-15,2017-01-03,2017-01-03,https://patents.google.com/patent/US9536584B2/en,https://patentimages.storage.googleapis.com/ea/b1/e9/9b1aa3cede92f6/US09536584-20170103-D00000.png
US-8848433-B2,Nonvolatile memory device ,Kabushiki Kaisha Toshiba,"Daisuke Saida, Minoru Amano, Naoharu Shimomura",2012-09-26,2013-03-12,2014-09-30,2014-09-30,https://patents.google.com/patent/US8848433B2/en,https://patentimages.storage.googleapis.com/5e/38/97/61257babbb5b84/US08848433-20140930-D00000.png
US-8742518-B2,Magnetic tunnel junction with free layer having exchange coupled magnetic elements ,Seagate Technology Llc,"Xiaobin Wang, Kaizhong Gao",2011-03-31,2011-03-31,2014-06-03,2014-06-03,https://patents.google.com/patent/US8742518B2/en,https://patentimages.storage.googleapis.com/41/40/fd/51dfbd2831aa67/US08742518-20140603-D00000.png
US-10891973-B2,High-bandwidth STO bias architecture with integrated slider voltage potential control ,"Western Digital Technologies, Inc.","John Contreras, Yunfei Ding, Kuok San Ho, Ian Robson McFadyen, Joey Martin Poss",2016-12-30,2020-03-11,2021-01-12,2021-01-12,https://patents.google.com/patent/US10891973B2/en,https://patentimages.storage.googleapis.com/9d/4c/1a/678093daf08a71/US10891973-20210112-D00000.png
US-10833253-B2,Low magnetic moment materials for spin transfer torque magnetoresistive random access memory devices ,International Business Machines Corporation,Guohan Hu,2016-02-05,2016-02-05,2020-11-10,2020-11-10,https://patents.google.com/patent/US10833253B2/en,https://patentimages.storage.googleapis.com/28/61/f2/e8826a1d0c6f39/US10833253-20201110-D00000.png
US-9698340-B2,Magnetic memory element and magnetic memory ,Kabushiki Kaisha Toshiba,"Yuichi Ohsawa, Naoharu Shimomura, Satoshi Shirotori",2015-03-17,2016-03-10,2017-07-04,2017-07-04,https://patents.google.com/patent/US9698340B2/en,https://patentimages.storage.googleapis.com/c5/39/28/bb8d2e2fda3ab5/US09698340-20170704-D00000.png
US-9166153-B2,System and process to remove film from semiconductor devices ,"Taiwan Semiconductor Manufacturing Company, Ltd.","Chern-Yow Hsu, Shih-Chang Liu, Chia-Shiung Tsai",2013-02-08,2013-05-10,2015-10-20,2015-10-20,https://patents.google.com/patent/US9166153B2/en,https://patentimages.storage.googleapis.com/b7/fb/24/9ecf06c841f69c/US09166153-20151020-D00000.png
US-10916282-B2,Control of switching trajectory in spin orbit torque devices by micromagnetic configuration ,International Business Machines Corporation,"Timothy Phung, Chirag Garg",2019-06-20,2019-06-20,2021-02-09,2021-02-09,https://patents.google.com/patent/US10916282B2/en,https://patentimages.storage.googleapis.com/fd/3d/ae/7dead3d650bed3/US10916282-20210209-D00000.png
US-9087981-B2,Methods of forming a magnetic tunnel junction device ,"Taiwan Semiconductor Manufacturing Company, Ltd.","Chern-Yow Hsu, Shih-Chang Liu, Chia-Shiung Tsai",2013-02-08,2013-02-08,2015-07-21,2015-07-21,https://patents.google.com/patent/US9087981B2/en,https://patentimages.storage.googleapis.com/72/5c/e5/a61fef1082520b/US09087981-20150721-D00000.png
US-9773837-B2,Scalable orthogonal spin transfer magnetic random access memory devices with reduced write error rates ,New York University,Andrew Kent,2013-06-17,2015-02-13,2017-09-26,2017-09-26,https://patents.google.com/patent/US9773837B2/en,https://patentimages.storage.googleapis.com/89/f3/69/48f274f0fa4add/US09773837-20170926-D00000.png
US-9859491-B2,Magnetoresistive element and magnetic memory ,Kabushiki Kaisha Toshiba,"Tadaomi Daibou, Yushi Kato, Shumpei OMINE, Naoki Hase, Junichi Ito",2014-03-13,2016-09-08,2018-01-02,2018-01-02,https://patents.google.com/patent/US9859491B2/en,https://patentimages.storage.googleapis.com/c9/33/cd/d1b6f1478ca695/US09859491-20180102-D00000.png
US-8553451-B2,Spin-torque transfer memory cell structures with symmetric switching and single direction programming ,"Micron Technology, Inc.",Jun Liu,2011-06-24,2011-06-24,2013-10-08,2013-10-08,https://patents.google.com/patent/US8553451B2/en,https://patentimages.storage.googleapis.com/0c/a1/24/6ac599b749b416/US08553451-20131008-D00000.png
US-11579217-B2,Devices and methods for frequency- and phase-based detection of magnetically-labeled molecules using spin torque oscillator (STO) sensors ,"Western Digital Technologies, Inc.","Patrick Braganca, Daniel Bedau",2019-04-12,2020-03-16,2023-02-14,2023-02-14,https://patents.google.com/patent/US11579217B2/en,https://patentimages.storage.googleapis.com/f2/32/b7/a7f5ccd86a64b7/US11579217-20230214-D00000.png
US-11738336-B2,Spin torque oscillator (STO) sensors used in nucleic acid sequencing arrays and detection schemes for nucleic acid sequencing ,"Western Digital Technologies, Inc.","Patrick Braganca, Daniel Bedau",2019-04-12,2020-02-14,2023-08-29,2023-08-29,https://patents.google.com/patent/US11738336B2/en,https://patentimages.storage.googleapis.com/84/36/87/4648620eb34986/US11738336-20230829-D00000.png
US-9130151-B2,Method and system for providing magnetic tunneling junctions usable in spin transfer torque magnetic memories ,"Samsung Electronics Co., Ltd.",William H. Butler,2010-01-11,2012-07-13,2015-09-08,2015-09-08,https://patents.google.com/patent/US9130151B2/en,https://patentimages.storage.googleapis.com/48/28/0f/bc87043eec2783/US09130151-20150908-D00000.png
US-9472750-B2,Method and system for providing a bottom pinned layer in a perpendicular magnetic junction usable in spin transfer torque magnetic random access memory applications ,"Samsung Electronics Co., Ltd.","Xueti Tang, Dustin William Erickson, Jang-eun Lee",2015-01-05,2015-12-21,2016-10-18,2016-10-18,https://patents.google.com/patent/US9472750B2/en,https://patentimages.storage.googleapis.com/9c/b4/b4/3d76af5c9906f7/US09472750-20161018-D00000.png
US-10991408-B2,Magnetic random access memory structure and manufacturing method of the same ,Taiwan Semiconductor Manufacturing Company Ltd.,"Harry-Hak-Lay Chuang, Sheng-Chang Chen",2017-11-30,2020-08-20,2021-04-27,2021-04-27,https://patents.google.com/patent/US10991408B2/en,https://patentimages.storage.googleapis.com/43/6c/d8/defe57ed118ded/US10991408-20210427-D00000.png
US-8451655-B2,MRAM cells and circuit for programming the same ,"Taiwan Semiconductor Manufacturing Company, Ltd.","Shine Chung, Hung-Sen Wang, Tao-Wen Chung, Chun-Jung Lin, Yu-Jen Wang",2009-02-23,2012-02-02,2013-05-28,2013-05-28,https://patents.google.com/patent/US8451655B2/en,https://patentimages.storage.googleapis.com/bd/1a/93/e3e3240c28101b/US08451655-20130528-D00000.png
US-9455012-B2,Magnetic device with spin polarisation ,"Commissariat a l'énergie atomique et aux énergies alternatives, Centre National De La Recherche Scientific (Cnrs), Universite Joseph Fourier Grenoble, Universitéparis Sud","Bernard Dieny, Ricardo Sousa, Bertrand LACOSTE, Thibaut Devolder",2014-11-27,2015-11-25,2016-09-27,2016-09-27,https://patents.google.com/patent/US9455012B2/en,https://patentimages.storage.googleapis.com/5f/73/64/840923567012ff/US09455012-20160927-D00000.png
US-11031545-B2,High stability free layer for perpendicular spin torque transfer memory ,Intel Corporation,"Kaan Oguz, Kevin P. O'Brien, Brian S. Doyle, Mark L. Doczy, Charles C. Kuo, Daniel G. OUELLETTE, Christopher J. Wiegand, Md Tofizur Rahman, Brian Maertz",2016-09-30,2016-09-30,2021-06-08,2021-06-08,https://patents.google.com/patent/US11031545B2/en,https://patentimages.storage.googleapis.com/68/ce/af/353db7236184ea/US11031545-20210608-D00000.png
US-10790441-B2,Spin-transfer-torque synthetic anti-ferromagnetic switching device ,Purdue Research Foundation,"Kerem Y. Camsari, Ahmed Zeeshan Pervaiz, Rafatul Faria, Esteban E Marinero-Caceres, Supriyo Datta",2016-03-14,2017-03-14,2020-09-29,2020-09-29,https://patents.google.com/patent/US10790441B2/en,https://patentimages.storage.googleapis.com/55/83/14/5d4535b7175831/US10790441-20200929-D00000.png
US-11264559-B2,Multilayered magnetic free layer structure for spin-transfer torque (STT) MRAM ,International Business Machines Corporation,"Daniel Worledge, Guohan Hu",2019-01-30,2019-01-30,2022-03-01,2022-03-01,https://patents.google.com/patent/US11264559B2/en,https://patentimages.storage.googleapis.com/70/a6/6e/e5e476bcbd6401/US11264559-20220301-D00000.png
US-7965542-B2,Magnetic random access memory and write method of the same ,Kabushiki Kaisha Toshiba,Yoshiaki Asao,2007-01-17,2008-01-16,2011-06-21,2011-06-21,https://patents.google.com/patent/US7965542B2/en,https://patentimages.storage.googleapis.com/8b/88/67/ff6fa645728116/US07965542-20110621-D00000.png
US-7990752-B2,Semiconductor memory ,Kabushiki Kaisha Toshiba,Yoshiaki Asao,2008-06-02,2009-06-02,2011-08-02,2011-08-02,https://patents.google.com/patent/US7990752B2/en,https://patentimages.storage.googleapis.com/cc/0d/99/bc48cf2b1b0924/US07990752-20110802-D00000.png
US-10109786-B2,Spin transfer torque magnetic tunnel junction with off-centered current flow ,International Business Machines Corporation,"Rolf Allenspach, Anthony J. Annunziata, Daniel C. Worledge, See-Hun Yang",2016-10-01,2017-12-04,2018-10-23,2018-10-23,https://patents.google.com/patent/US10109786B2/en,https://patentimages.storage.googleapis.com/f8/90/9b/f93d289794f203/US10109786-20181023-D00000.png
US-9966528-B2,Method and system for providing a magnetic layer in a magnetic junction usable in spin transfer torque applications using a sacrificial oxide layer ,"Samsung Electronics Co., Ltd.","Xueti Tang, Mohamad Towfik Krounbi, Gen Feng, Vladimir Nikitin",2016-03-07,2016-06-08,2018-05-08,2018-05-08,https://patents.google.com/patent/US9966528B2/en,https://patentimages.storage.googleapis.com/3b/57/f1/253763ca2438bc/US09966528-20180508-D00000.png
US-10121960-B2,Method and system for providing magnetic junctions usable in spin transfer torque applications utilizing interstitial glass-forming agent(s) ,"Samsung Electronics Co., Ltd.","Roman Chepulskyy, Dmytro Apalkov",2016-10-17,2016-12-08,2018-11-06,2018-11-06,https://patents.google.com/patent/US10121960B2/en,https://patentimages.storage.googleapis.com/e9/3c/68/f9b46dbac40d53/US10121960-20181106-D00000.png
US-10438638-B2,Method and system for providing a magnetic layer in a magnetic junction usable in spin transfer or spin orbit torque applications using a sacrificial oxide layer ,"Samsung Electronics Co., Ltd.","Xueti Tang, Mohamad Towfik Krounbi, Gen Feng, Vladimir Nikitin",2016-03-07,2018-04-27,2019-10-08,2019-10-08,https://patents.google.com/patent/US10438638B2/en,https://patentimages.storage.googleapis.com/25/60/ef/438d422c7984af/US10438638-20191008-D00000.png
US-10839828-B2,Magnetic write head with current guiding layer ,"Western Digital Technologies, Inc.","Quang Le, Hongquan Jiang, Michael Kuok San Ho",2017-12-19,2019-02-15,2020-11-17,2020-11-17,https://patents.google.com/patent/US10839828B2/en,https://patentimages.storage.googleapis.com/3d/aa/12/8f23d86748cafc/US10839828-20201117-D00000.png
US-11189304-B2,Spin injection assisted magnetic recording ,"Headway Technologies, Inc.",Yan Wu,2019-09-06,2019-09-06,2021-11-30,2021-11-30,https://patents.google.com/patent/US11189304B2/en,https://patentimages.storage.googleapis.com/22/cf/49/3c6c382dd92890/US11189304-20211130-D00000.png
US-9349440-B1,Non-volatile SRAM with multiple storage states ,Empire Technology Development Llc,Yanjun Ma,2014-12-11,2014-12-11,2016-05-24,2016-05-24,https://patents.google.com/patent/US9349440B1/en,https://patentimages.storage.googleapis.com/50/e0/25/6983455e180b16/US09349440-20160524-D00000.png
US-9672846-B1,STO bias control for MAMR head reliability ,"Western Digital Technologies, Inc.","Hideaki Tanaka, Katsuro Watanabe, Shigeru Tadokoro, Wataru Kimura, Yohji Maruyama",2016-06-21,2016-06-21,2017-06-06,2017-06-06,https://patents.google.com/patent/US9672846B1/en,https://patentimages.storage.googleapis.com/32/a4/50/61f34a0446cf89/US09672846-20170606-D00000.png
