US-10950259-B2,Magnetic head and magnetic recording and reproducing device ,Kabushiki Kaisha Toshiba,"Naoyuki Narita, Hirofumi Suto, Tomoyuki Maeda",2018-08-20,2020-06-28,2021-03-16,2021-03-16,https://patents.google.com/patent/US10950259B2/en,https://patentimages.storage.googleapis.com/f6/04/47/c0168ada79b6f6/US10950259-20210316-D00000.png
US-11502243-B2,Structured pedestal for MTJ containing devices ,International Business Machines Corporation,"Nathan P. Marchack, Bruce B. Doris",2019-01-22,2020-12-28,2022-11-15,2022-11-15,https://patents.google.com/patent/US11502243B2/en,https://patentimages.storage.googleapis.com/a0/53/db/303d54caa080f8/US11502243-20221115-D00000.png
US-11683991-B2,Semiconductor structure and manufacturing method of the same ,Taiwan Semiconductor Manufacturing Company Ltd.,"Tai-Yen PENG, Yu-Shu Chen, Chien Chung Huang, Sin-Yi Yang, Chen-Jung Wang, Han-Ting Lin, Jyu-Horng Shieh, Qiang Fu",2018-07-30,2020-11-24,2023-06-20,2023-06-20,https://patents.google.com/patent/US11683991B2/en,https://patentimages.storage.googleapis.com/03/b0/dd/137ce8f205372d/US11683991-20230620-D00000.png
US-10263182-B2,Magnetoresistance effect element ,Tdk Corporation,Tomoyuki Sasaki,2016-09-29,2017-09-22,2019-04-16,2019-04-16,https://patents.google.com/patent/US10263182B2/en,https://patentimages.storage.googleapis.com/d8/be/53/9af848706d943a/US10263182-20190416-D00000.png
US-10892400-B2,Magnetic memory device ,"Samsung Electronics Co., Ltd.","Eun-Sun NOH, Ju-Hyun Kim, Joon-myoung LEE, Woo-Chang Lim",2018-12-11,2019-07-16,2021-01-12,2021-01-12,https://patents.google.com/patent/US10892400B2/en,https://patentimages.storage.googleapis.com/7d/12/34/6e11b55479db8b/US10892400-20210112-D00000.png
US-9680088-B2,Ferromagnetic tunnel junction element and method of driving ferromagnetic tunnel junction element ,"Iii Holdings 3, Llc",Takuya Ono,2008-03-06,2014-11-24,2017-06-13,2017-06-13,https://patents.google.com/patent/US9680088B2/en,https://patentimages.storage.googleapis.com/ff/a9/fb/b9cdc1fc51784b/US09680088-20170613-D00000.png
US-9859018-B2,Physically unclonable function based on domain wall memory and method of use ,University Of South Florida,"Swaroop Ghosh, Anirudh Srikant Iyengar, Kenneth Ramclam",2014-05-05,2016-11-07,2018-01-02,2018-01-02,https://patents.google.com/patent/US9859018B2/en,https://patentimages.storage.googleapis.com/7a/0e/5b/a57f65da623e06/US09859018-20180102-D00000.png
US-8164940-B2,Read/write structures for a three dimensional memory ,"Hitachi Global Storage Technologies Netherlands, B.V.","Ozhan Ozatay, Bruce D. Terris",2009-12-15,2009-12-15,2012-04-24,2012-04-24,https://patents.google.com/patent/US8164940B2/en,https://patentimages.storage.googleapis.com/b2/95/5b/9e079934d6964b/US08164940-20120424-D00000.png
US-11043531-B2,Semiconductor structure and manufacturing method of the same ,Taiwan Semiconductor Manufacturing Company Ltd.,"Alexander Kalnitsky, Sheng-Huang Huang, Harry-Hak-Lay Chuang, Jiunyu Tsai, Hung Cho Wang",2017-11-08,2019-11-20,2021-06-22,2021-06-22,https://patents.google.com/patent/US11043531B2/en,https://patentimages.storage.googleapis.com/d4/91/19/0df3ba8102eb32/US11043531-20210622-D00000.png
US-8313959-B1,Hole first hardmask definition ,"Taiwan Semiconductor Manufacturing Company, Ltd.","Wei-Hang Huang, Shih-Chang Liu, Chern-Yow Hsu, Fu-Ting Sung, Chia-Shiung Tsai",2011-08-17,2011-08-17,2012-11-20,2012-11-20,https://patents.google.com/patent/US8313959B1/en,https://patentimages.storage.googleapis.com/81/b1/c8/866e3f5f01be7f/US08313959-20121120-D00000.png
US-10658571-B2,Semiconductor structure and method for manufacturing the same ,Taiwan Semiconductor Manufacturing Company Ltd.,"Chern-Yow Hsu, Shih-Chang Liu",2017-11-17,2018-08-23,2020-05-19,2020-05-19,https://patents.google.com/patent/US10658571B2/en,https://patentimages.storage.googleapis.com/3a/ee/0b/873b76b0495a0e/US10658571-20200519-D00000.png
US-9634243-B1,Semiconductor structure and method of forming the same ,Taiwan Semiconductor Manufacturing Company Ltd.,"Harry-Hak-Lay Chuang, Chun-Heng Liao",2015-11-27,2015-11-27,2017-04-25,2017-04-25,https://patents.google.com/patent/US9634243B1/en,https://patentimages.storage.googleapis.com/52/09/da/b511ae1c227707/US09634243-20170425-D00000.png
US-11342378-B2,Magnetic tunnel junction device with residue-protection sidewall spacer and the method for forming a magnetic tunnel junction device with residue-protection sidewall spacer ,Taiwan Semiconductor Manufacturing Company Ltd.,Chern-Yow Hsu,2019-04-25,2019-04-25,2022-05-24,2022-05-24,https://patents.google.com/patent/US11342378B2/en,https://patentimages.storage.googleapis.com/b7/a4/41/c88295ead9e723/US11342378-20220524-D00000.png
US-9130156-B2,Process to remove film from semiconductor devices ,"Taiwan Semiconductor Manufacturing Company, Ltd.","Chern-Yow Hsu, Shih-Chang Liu, Chia-Shiung Tsai",2013-02-08,2013-02-08,2015-09-08,2015-09-08,https://patents.google.com/patent/US9130156B2/en,https://patentimages.storage.googleapis.com/90/3d/81/037056a96f31e2/US09130156-20150908-D00000.png
US-9722173-B2,Memory device ,Kabushiki Kaisha Toshiba,"Daisuke Saida, Naoharu Shimomura",2014-03-20,2016-08-26,2017-08-01,2017-08-01,https://patents.google.com/patent/US9722173B2/en,https://patentimages.storage.googleapis.com/3f/07/d6/3a63d2b332aa37/US09722173-20170801-D00000.png
US-8270197-B2,Method of operating information storage device using magnetic domain wall movement ,"Samsung Electronics Co., Ltd.",Sung-Chul Lee,2008-06-16,2008-10-24,2012-09-18,2012-09-18,https://patents.google.com/patent/US8270197B2/en,https://patentimages.storage.googleapis.com/b0/2a/0b/ddc7c72c18dc31/US08270197-20120918-D00000.png
US-8476724-B2,Spin wave device ,Kabushiki Kaisha Toshiba,"Tsuyoshi Kondo, Hirofumi Morise, Shiho Nakamura",2010-09-14,2011-09-12,2013-07-02,2013-07-02,https://patents.google.com/patent/US8476724B2/en,https://patentimages.storage.googleapis.com/98/a5/01/22b7dee429a27c/US08476724-20130702-D00000.png
US-8976578-B2,Memory element and memory apparatus ,Sony Corporation,"Yutaka Higo, Masanori Hosomi, Hiroyuki Ohmori, Kazuhiro Bessho, Tetsuya Asayama, Kazutaka Yamane, Hiroyuki Uchida",2011-11-30,2012-11-13,2015-03-10,2015-03-10,https://patents.google.com/patent/US8976578B2/en,https://patentimages.storage.googleapis.com/2b/ef/45/67a08f6798be8f/US08976578-20150310-D00000.png
US-10916696-B2,Method for manufacturing magnetic memory element with post pillar formation annealing ,"Spin Memory, Inc.","Mustafa Pinarbasi, Pradeep MANANDHAR, Jorge Vasquez, Bartlomiej Adam KARDASZ, Thomas D. Boone",2019-05-01,2019-05-01,2021-02-09,2021-02-09,https://patents.google.com/patent/US10916696B2/en,https://patentimages.storage.googleapis.com/ec/c7/f1/78eaeb8ba784d6/US10916696-20210209-D00000.png
US-10944044-B2,MRAM structure with T-shaped bottom electrode to overcome galvanic effect ,International Business Machines Corporation,"Pouya Hashemi, Bruce B. Doris, Eugene J. O'Sullivan, Michael F. Lofaro",2019-08-07,2019-08-07,2021-03-09,2021-03-09,https://patents.google.com/patent/US10944044B2/en,https://patentimages.storage.googleapis.com/9d/49/75/2fae92b60da99e/US10944044-20210309-D00000.png
US-11114606-B2,MRAM devices containing a harden gap fill dielectric material ,International Business Machines Corporation,"Alexander Reznicek, Devika Sil, Oleg Gluschenkov, Yasir Sulehria",2019-09-23,2019-09-23,2021-09-07,2021-09-07,https://patents.google.com/patent/US11114606B2/en,https://patentimages.storage.googleapis.com/95/f6/cd/36e0c419fee3df/US11114606-20210907-D00000.png
US-8120948-B2,Data writing method for magnetoresistive effect element and magnetic memory ,Kabushiki Kaisha Toshiba,"Masahiko Nakayama, Hisanori Aikawa, Tsuneo Inaba, Kenji Tsuchida, Sumio Ikegawa, Hiroaki Yoda, Naoharu Shimomura",2008-09-25,2009-09-17,2012-02-21,2012-02-21,https://patents.google.com/patent/US8120948B2/en,https://patentimages.storage.googleapis.com/e9/a1/8a/190f0e911ddfb7/US08120948-20120221-D00000.png
US-8867266-B2,Method for driving storage element and storage device ,Sony Corporation,"Kazuhiro Bessho, Masanori Hosomi, Hiroyuki Ohmori, Yutaka Higo, Kazutaka Yamane, Hiroyuki Uchida",2010-06-18,2011-05-10,2014-10-21,2014-10-21,https://patents.google.com/patent/US8867266B2/en,https://patentimages.storage.googleapis.com/50/9f/bc/e82849e6fa57e1/US08867266-20141021-D00000.png
US-11588099-B2,Reservoir element and neuromorphic element ,Tdk Corporation,"Tomoyuki Sasaki, Tatsuo Shibata",2018-09-12,2019-09-10,2023-02-21,2023-02-21,https://patents.google.com/patent/US11588099B2/en,https://patentimages.storage.googleapis.com/94/37/d1/8bb892abfac773/US11588099-20230221-D00000.png
US-9515124-B2,"Magnetic memory, magnetic memory device, and method for manufacturing magnetic memory ",Kabushiki Kaisha Toshiba,"Shiho Nakamura, Yuuzo Kamiguchi, Yasuaki Ootera, Tsuyoshi Kondo",2014-08-25,2015-08-18,2016-12-06,2016-12-06,https://patents.google.com/patent/US9515124B2/en,https://patentimages.storage.googleapis.com/03/5e/8e/b89c19485146ac/US09515124-20161206-D00000.png
US-9135933-B2,Tapered write head for MAMR ,HGST Netherlands B.V.,"Isao Nunokawa, Mikito Sugiyama, Yuta Udo",2013-11-08,2013-11-08,2015-09-15,2015-09-15,https://patents.google.com/patent/US9135933B2/en,https://patentimages.storage.googleapis.com/e2/c7/a8/7b1c7f66f74a03/US09135933-20150915-D00000.png
US-11721359-B2,Magnetic head and magnetic recording device ,"Kabushiki Kaisha Toshiba, Toshiba Electronic Devices & Storage Corporation","Yuji Nakagawa, Naoyuki Narita, Masayuki Takagishi, Tomoyuki Maeda, Tazumi Nagasawa",2021-05-28,2022-01-28,2023-08-08,2023-08-08,https://patents.google.com/patent/US11721359B2/en,https://patentimages.storage.googleapis.com/3f/3b/2d/d74f3a3df4dc1d/US11721359-20230808-D00000.png
US-10431628-B2,Dual channel/gate vertical field-effect transistor (FET) for use with a perpendicular magnetic tunnel junction (PMTJ) ,"Spin Memory, Inc.","Kuk-Hwan Kim, Marcin Gajek, Dafna Beery, Amitay Levi",2018-01-09,2018-01-09,2019-10-01,2019-10-01,https://patents.google.com/patent/US10431628B2/en,https://patentimages.storage.googleapis.com/0a/8d/f3/84e69ebef523e9/US10431628-20191001-D00000.png
US-11094359-B2,High retention multi-level-series magnetic random-access memory ,"Spin Memory, Inc.","Kadriye Deniz Bozdag, Mustafa Pinarbasi",2019-01-24,2019-01-24,2021-08-17,2021-08-17,https://patents.google.com/patent/US11094359B2/en,https://patentimages.storage.googleapis.com/8e/aa/25/bd406d092533ff/US11094359-20210817-D00000.png
US-8610512-B2,Synthesizer of an oscillating signal ,Commissariat A L'energie Atomique Et Aux Energies Alternatives,"Jean-Philippe Michel, Michaël Quinsat",2011-04-20,2012-04-20,2013-12-17,2013-12-17,https://patents.google.com/patent/US8610512B2/en,https://patentimages.storage.googleapis.com/ac/05/45/941009cdf092ae/US08610512-20131217-D00000.png
US-10236075-B1,Predicting tunnel barrier endurance using redundant memory structures ,"Spin Memory, Inc.","Kuk-Hwan Kim, Peter Cuevas, Benjamin Louie, Amitay Levi",2017-12-21,2017-12-21,2019-03-19,2019-03-19,https://patents.google.com/patent/US10236075B1/en,https://patentimages.storage.googleapis.com/2d/82/48/b22e03b1902575/US10236075-20190319-D00000.png
US-10297301-B2,Method and system for providing magnetic junctions utilizing high crystallization temperature-containing insertion layer(s) ,"Samsung Electronics Co., Ltd.","Don Koun Lee, Mohamad Towfik Krounbi",2017-08-28,2018-05-08,2019-05-21,2019-05-21,https://patents.google.com/patent/US10297301B2/en,https://patentimages.storage.googleapis.com/07/0d/1e/3c4fdd86d7f134/US10297301-20190521-D00000.png
US-7916431-B2,Magnetoresistive element including insulating film touching periphery of spacer layer ,Tdk Corporation,"Yoshihiro Tsuchiya, Tomohito Mizuno, Shinji Hara, Daisuke Miyauchi, Takahiko Machita",2007-08-27,2007-08-27,2011-03-29,2011-03-29,https://patents.google.com/patent/US7916431B2/en,https://patentimages.storage.googleapis.com/ac/94/e4/78e99fd21904af/US07916431-20110329-D00000.png
US-10290338-B2,Tilted synthetic antiferromagnet polarizer/reference layer for STT-MRAM bits ,"Western Digital Technologies, Inc.","Patrick M. Braganca, John C. Read",2015-08-31,2017-12-18,2019-05-14,2019-05-14,https://patents.google.com/patent/US10290338B2/en,https://patentimages.storage.googleapis.com/51/34/99/3e856f41607f67/US10290338-20190514-D00000.png
US-9633706-B1,Voltage self-boosting circuit for generating a boosted voltage for driving a word line write in a memory array for a memory write operation ,Qualcomm Incorporated,"Sungryul KIM, Jung Pill Kim, Hyunsuk Shin",2016-10-10,2016-10-10,2017-04-25,2017-04-25,https://patents.google.com/patent/US9633706B1/en,https://patentimages.storage.googleapis.com/0f/69/a5/2d530893171625/US09633706-20170425-D00000.png
US-9875779-B2,Storage element and memory ,Sony Corporation,"Yutaka Higo, Masanori Hosomi, Hiroyuki Ohmori, Kazuhiro Bessho, Tetsuya Asayama, Kazutaka Yamane, Hiroyuki Uchida",2011-11-30,2016-01-04,2018-01-23,2018-01-23,https://patents.google.com/patent/US9875779B2/en,https://patentimages.storage.googleapis.com/a6/d6/9e/6d8a2f1830d247/US09875779-20180123-D00000.png
US-10186551-B1,Buried tap for a vertical transistor used with a perpendicular magnetic tunnel junction (PMTJ) ,"Spin Transfer Technologies, Inc.","Kuk-Hwan Kim, Dafna Beery, Gian Sharma, Amitay Levi, Andrew J. Walker",2018-01-08,2018-01-08,2019-01-22,2019-01-22,https://patents.google.com/patent/US10186551B1/en,https://patentimages.storage.googleapis.com/8c/35/aa/1e38823c818b10/US10186551-20190122-D00000.png
US-10388860-B2,Method for manufacturing high density magnetic random access memory devices using diamond like carbon hard mask ,"Spin Memory, Inc.","Elizabeth A. Dobisz, Girish Jagtiani, Yuan-Tung CHIN, Thomas D. Boone, Mustafa Pinarbasi",2017-12-30,2017-12-30,2019-08-20,2019-08-20,https://patents.google.com/patent/US10388860B2/en,https://patentimages.storage.googleapis.com/5e/cb/91/c9b7c4d3e87f26/US10388860-20190820-D00000.png
US-10629649-B2,Method of making a three dimensional perpendicular magnetic tunnel junction with thin-film transistor ,"Spin Memory, Inc.","Kuk-Hwan Kim, Dafna Beery, Amitay Levi, Andrew J. Walker",2017-12-29,2017-12-29,2020-04-21,2020-04-21,https://patents.google.com/patent/US10629649B2/en,https://patentimages.storage.googleapis.com/e6/6b/9c/1b1d4124251906/US10629649-20200421-D00000.png
US-10707268-B2,Magnetoresistive element and magnetic memory ,Toshiba Memory Corporation,"Masaki Endo, Tadaomi Daibou, Shumpei OMINE, Akiyuki MURAYAMA, Junichi Ito",2016-09-20,2018-08-14,2020-07-07,2020-07-07,https://patents.google.com/patent/US10707268B2/en,https://patentimages.storage.googleapis.com/03/ec/16/f8179b7fabf2c5/US10707268-20200707-D00000.png
US-10861522-B2,"Storage device, manufacturing method therefor, and storage apparatus ",Sony Corporation,"Hiroyuki Ohmori, Masanori Hosomi, Kazuhiro Bessho, Yutaka Higo, Kazutaka Yamane, Hiroyuki Uchida",2015-03-05,2019-05-30,2020-12-08,2020-12-08,https://patents.google.com/patent/US10861522B2/en,https://patentimages.storage.googleapis.com/e8/82/ed/a169757c42a8dc/US10861522-20201208-D00000.png
US-11551737-B2,Magnetic storage element and electronic apparatus ,Sony Semiconductor Solutions Corporation,"Naoki Hase, Masanori Hosomi, Yutaka Higo, Hiroyuki Ohmori, Hiroyuki Uchida, Yo Sato",2017-04-03,2018-01-15,2023-01-10,2023-01-10,https://patents.google.com/patent/US11551737B2/en,https://patentimages.storage.googleapis.com/60/4c/4a/773fd23a6b4729/US11551737-20230110-D00000.png
US-10685692-B2,Electronic devices and method for fabricating the same ,SK Hynix Inc.,"Jong-koo Lim, Yang-Kon KIM, Ku-Youl Jung, Guk-Cheon Kim, Jeong-myeong Kim",2017-02-16,2018-01-22,2020-06-16,2020-06-16,https://patents.google.com/patent/US10685692B2/en,https://patentimages.storage.googleapis.com/47/85/d8/be906d65f22584/US10685692-20200616-D00000.png
US-10937479-B1,Integration of epitaxially grown channel selector with MRAM device ,"Spin Memory, Inc.","Dafna Beery, Amitay Levi, Andrew J. Walker",2019-08-29,2019-08-29,2021-03-02,2021-03-02,https://patents.google.com/patent/US10937479B1/en,https://patentimages.storage.googleapis.com/38/e8/8e/44f1e45791ce4f/US10937479-20210302-D00000.png
US-10714126-B2,Magnetic recording head and disk device including the same ,"Kabushiki Kaisha Toshiba, Toshiba Electronic Devices & Storage Corporation",Takuya Matsumoto,2018-05-15,2019-02-25,2020-07-14,2020-07-14,https://patents.google.com/patent/US10714126B2/en,https://patentimages.storage.googleapis.com/25/27/06/ca11bc99aa9872/US10714126-20200714-D00000.png
US-9070457-B2,Magnetic tunnel junctions with perpendicular magnetization and magnetic random access memory ,Tohoku University,"Hideo Ohno, Shoji Ikeda, Michihiko Yamanouchi, Hideo Sato, Katsuya Miura",2011-05-27,2012-05-24,2015-06-30,2015-06-30,https://patents.google.com/patent/US9070457B2/en,https://patentimages.storage.googleapis.com/62/b7/a7/7fb1238d16c010/US09070457-20150630-D00000.png
US-11063209-B2,"Method and system for providing magnetic junctions utilizing oxygen blocking, oxygen adsorber and tuning layer(s) ","Samsung Electronics Co., Ltd.","Xueti Tang, Gen Feng, Mohamad Towfik Krounbi",2017-05-30,2017-07-25,2021-07-13,2021-07-13,https://patents.google.com/patent/US11063209B2/en,https://patentimages.storage.googleapis.com/d3/38/28/1a05dacddaabbb/US11063209-20210713-D00000.png
US-11444239-B1,Magnetoresistive element having an adjacent-bias layer and a toggle writing scheme ,"Yimin Guo, Rongfu Xiao, Jun Chen","Yimin Guo, Rongfu Xiao, Jun Chen",2021-02-28,2021-02-28,2022-09-13,2022-09-13,https://patents.google.com/patent/US11444239B1/en,https://patentimages.storage.googleapis.com/fb/58/f1/47095e0a5af467/US11444239-20220913-D00000.png
US-10672977-B2,Perpendicular magnetoresistive elements ,Yimin Guo,Yimin Guo,2012-12-21,2013-10-25,2020-06-02,2020-06-02,https://patents.google.com/patent/US10672977B2/en,https://patentimages.storage.googleapis.com/50/9e/ce/480319a5b42700/US10672977-20200602-D00000.png
US-10224087-B1,Sensing voltage based on a supply voltage applied to magneto-resistive random access memory (MRAM) bit cells in an MRAM for tracking write operations to the MRAM bit cells ,"Qualcomm Technologies, Incorporated, Yonsei University, University Industry Foundation","Seong-Ook Jung, Sara CHOI, Hong Keun AHN, Seung Hyuk Kang, Sungryul KIM",2017-12-21,2017-12-21,2019-03-05,2019-03-05,https://patents.google.com/patent/US10224087B1/en,https://patentimages.storage.googleapis.com/9b/94/64/61691f9f41554c/US10224087-20190305-D00000.png
US-11393493-B1,Magnetic head and magnetic recording device ,"Kabushiki Kaisha Toshiba, Toshiba Electronic Devices & Storage Corporation","Yuji Nakagawa, Naoyuki Narita, Masayuki Takagishi, Tomoyuki Maeda, Tazumi Nagasawa, Hitoshi Iwasaki, Hirofumi Suto",2021-02-12,2021-08-10,2022-07-19,2022-07-19,https://patents.google.com/patent/US11393493B1/en,https://patentimages.storage.googleapis.com/5b/b7/3b/f88dbcf0b8ff4e/US11393493-20220719-D00000.png
US-10236046-B2,Method of propagating magnetic domain wall in magnetic devices ,"Imec Vzw, Katholieke Universiteit Leuven",Adrien Vaysset,2016-11-09,2017-11-08,2019-03-19,2019-03-19,https://patents.google.com/patent/US10236046B2/en,https://patentimages.storage.googleapis.com/db/92/69/d25e99e4670c82/US10236046-20190319-D00000.png
US-11011193-B1,Dual flux change layer (FCL) assisted magnetic recording ,"Headway Technologies, Inc.","Yan Wu, Wenyu Chen, Shohei Kawasaki",2020-02-04,2020-02-04,2021-05-18,2021-05-18,https://patents.google.com/patent/US11011193B1/en,https://patentimages.storage.googleapis.com/9b/20/7f/2b9b84b00587fe/US11011193-20210518-D00000.png
US-7957106-B2,Chemically disordered material used to form a free layer or a pinned layer of a magnetoresistance (MR) read element ,"Hitachi Global Storage Technologies Netherlands, B.V.","Matthew J. Carey, Jeffrey R. Childress, Stefan Maat",2007-04-30,2007-04-30,2011-06-07,2011-06-07,https://patents.google.com/patent/US7957106B2/en,https://patentimages.storage.googleapis.com/6c/f9/c5/68f77c8e254a18/US07957106-20110607-D00000.png
US-9583123-B2,"Magnetoresistance effect element, magnetic head, magnetic head assembly, magnetic recording and reproducing device, and method for manufacturing magnetoresistance effect element ",Kabushiki Kaisha Toshiba,"Yousuke Isowaki, Satoshi Shirotori, Masayuki Takagishi, Hitoshi Iwasaki",2013-04-01,2015-10-05,2017-02-28,2017-02-28,https://patents.google.com/patent/US9583123B2/en,https://patentimages.storage.googleapis.com/07/4a/43/05bfceff5ecfc8/US09583123-20170228-D00000.png
US-9195787-B2,Methods and apparatus for modeling and simulating spintronic integrated circuits ,Intel Corporation,"Sasikanth Manipatruni, Dmitri E. Nikonov, Ian A. Young",2012-11-20,2012-11-20,2015-11-24,2015-11-24,https://patents.google.com/patent/US9195787B2/en,https://patentimages.storage.googleapis.com/22/04/0e/9db5c9e335186b/US09195787-20151124-D00000.png
US-8270207-B2,Raising programming current of magnetic tunnel junctions by applying P-sub bias and adjusting threshold voltage ,"Taiwan Semiconductor Manufacturing Company, Ltd.","Shine Chung, Tao-Wen Chung, Chun-Jung Lin, Yu-Jen Wang",2009-04-16,2010-01-14,2012-09-18,2012-09-18,https://patents.google.com/patent/US8270207B2/en,https://patentimages.storage.googleapis.com/ad/56/00/ed262a3f17319e/US08270207-20120918-D00000.png
US-11074951-B2,Magnetic memory device ,Toshiba Memory Corporation,Tatsuya Kishi,2019-03-20,2019-09-11,2021-07-27,2021-07-27,https://patents.google.com/patent/US11074951B2/en,https://patentimages.storage.googleapis.com/46/52/89/67e4c32965c0c6/US11074951-20210727-D00000.png
US-8207806-B2,Magnetic oscillation element ,Kabushiki Kaisha Toshiba,"Kiwamu Kudo, Koichi Mizushima, Tazumi Nagasawa, Rie Sato",2009-02-24,2011-08-24,2012-06-26,2012-06-26,https://patents.google.com/patent/US8207806B2/en,https://patentimages.storage.googleapis.com/7e/43/08/937dfa5abc4d41/US08207806-20120626-D00000.png
US-10601368-B2,Solid state microwave generator ,Seagate Technology Llc,Bin Lu,2016-05-19,2016-08-15,2020-03-24,2020-03-24,https://patents.google.com/patent/US10601368B2/en,https://patentimages.storage.googleapis.com/5d/ac/94/12babc4c9a4808/US10601368-20200324-D00000.png
US-9355698-B2,Memory and logic device and methods for performing thereof ,"Yeda Research And Development Co. Ltd., Yissum Research Development Company Of The Hebrew University Of Jerusalem Ltd.","Ron Naaman, Yossef PALTIEL, Sivan Kober, Gilad Gotesman",2012-03-13,2013-03-13,2016-05-31,2016-05-31,https://patents.google.com/patent/US9355698B2/en,https://patentimages.storage.googleapis.com/5c/33/94/ae399940852602/US09355698-20160531-D00000.png
US-11038100-B1,Magnetoresistive element having a perpendicular AFM structure ,Yimin Guo,Yimin Guo,2013-11-06,2019-11-26,2021-06-15,2021-06-15,https://patents.google.com/patent/US11038100B1/en,https://patentimages.storage.googleapis.com/f4/24/1e/d67227a4d2e64a/US11038100-20210615-D00000.png
US-10355202-B2,Magnetoresistance effect element ,Tdk Corporation,Tomoyuki Sasaki,2016-09-29,2017-09-22,2019-07-16,2019-07-16,https://patents.google.com/patent/US10355202B2/en,https://patentimages.storage.googleapis.com/be/26/da/a28aef8e038193/US10355202-20190716-D00000.png
US-11495250-B2,Magnetic recording device including a magnetic head including a stacked body between magnetic poles ,"Kabushiki Kaisha Toshiba, Toshiba Electronic Devices & Storage Corporation","Hitoshi Iwasaki, Naoyuki Narita, Hirofumi Suto, Masayuki Takagishi, Tazumi Nagasawa",2020-11-19,2021-08-10,2022-11-08,2022-11-08,https://patents.google.com/patent/US11495250B2/en,https://patentimages.storage.googleapis.com/a0/24/30/f4017e537661b4/US11495250-20221108-D00000.png
US-9721631-B2,Precessional magnetization reversal in a magnetic tunnel junction with a perpendicular polarizer ,New York University,"Andrew Kent, Huanlong Liu",2013-03-14,2014-03-14,2017-08-01,2017-08-01,https://patents.google.com/patent/US9721631B2/en,https://patentimages.storage.googleapis.com/c0/5c/52/d0e40cf8b35275/US09721631-20170801-D00000.png
US-9935260-B2,Magnetic memory device and nonvolatile memory apparatus ,Kabushiki Kaisha Toshiba,"Daisuke Saida, Shogo Itai, Chikayoshi Kamata",2016-03-22,2016-09-14,2018-04-03,2018-04-03,https://patents.google.com/patent/US9935260B2/en,https://patentimages.storage.googleapis.com/80/31/0c/ba2be18aaccc3a/US09935260-20180403-D00000.png
US-10971245-B1,Measurement of MTJ in a compact memory array ,"Spin Memory, Inc.",Minh Quang Tran,2019-09-20,2019-09-20,2021-04-06,2021-04-06,https://patents.google.com/patent/US10971245B1/en,https://patentimages.storage.googleapis.com/a4/b0/98/29bb7f49a9bc2b/US10971245-20210406-D00000.png
US-10559412-B2,Magnetoresistance effect device ,Tdk Corporation,"Akimasa Kaizu, Naomichi Degawa, Tetsuya Roppongi",2017-12-07,2018-11-29,2020-02-11,2020-02-11,https://patents.google.com/patent/US10559412B2/en,https://patentimages.storage.googleapis.com/4c/a9/46/0216f8379cee9c/US10559412-20200211-D00000.png
US-8745120-B2,Adder ,Kabushiki Kaisha Toshiba,"Hirofumi Morise, Shiho Nakamura, Daisuke Saida, Tsuyoshi Kondo",2009-09-17,2012-01-13,2014-06-03,2014-06-03,https://patents.google.com/patent/US8745120B2/en,https://patentimages.storage.googleapis.com/70/bb/03/2af469b90c9d50/US08745120-20140603-D00000.png
US-10566521-B2,Magnetic memory devices based on 4D and 5D transition metal perovskites ,Wisconsin Alumni Research Foundation,"Chang-Beom Eom, Tianxiang Nan, Trevor Jeffrey Anderson",2017-06-28,2018-06-27,2020-02-18,2020-02-18,https://patents.google.com/patent/US10566521B2/en,https://patentimages.storage.googleapis.com/3a/1a/c3/879d64fd12f3fa/US10566521-20200218-D00000.png
